{
  "$schema": "../../schemas/note.schema.json",
  "id": "01M5YNW98CNNKNCWQQT77SECD3",
  "kind": "invariant",
  "area": "tooling",
  "title": "`@types/node` must stay on the Node runtime's major",
  "symptoms": [],
  "cause": "Dependabot proposes major updates to `@types/node` (it bumped 24 to 26). Types from a newer major let code type-check against Node APIs that do not exist on the Node 24 runtime the repo targets.",
  "fix": "Keep `@types/node` on the same major as `engines.node` and `.nvmrc`. Dependabot ignores its major updates; bump all three together when moving to a new Node major.",
  "anchors": {
    "dependencies": [{ "name": "@types/node", "range": "^24" }, { "name": "node", "range": ">=24.15" }],
    "paths": ["package.json", ".nvmrc", ".github/dependabot.yml"]
  },
  "check": {
    "kind": "test",
    "ref": "scripts/scripts.test.ts",
    "name": "keeps @types/node on the same major as engines and .nvmrc"
  },
  "status": "active",
  "actor": { "kind": "agent", "tool": "claude-code", "model": "claude-opus-5-5", "reviewed": false },
  "links": [{ "kind": "github-pr", "ref": "#2", "url": "https://github.com/Pixerate/poetics/pull/2" }]
}
