{
  "$schema": "../../schemas/note.schema.json",
  "id": "01M5YKKDBE3TEHAAXA6W2YHQ8C",
  "kind": "gotcha",
  "area": "sqlite",
  "title": "The index looks stale or wrong",
  "symptoms": [],
  "cause": "The index is only updated by `rebuildIndex` (`pnpm reindex`).",
  "fix": "`pnpm reindex`. If in doubt, `pnpm reindex --fresh`; it is always safe to delete `.poetics/cache/`.",
  "anchors": {
    "commands": [
      "pnpm reindex"
    ],
    "units": [
      {
        "uid": "01M5XDBC7XBXKJEG8FHJZGB77B",
        "observedAt": "git:7b295f18d5a1ec3d6a833fe2b4f61ae521c16838"
      }
    ]
  },
  "status": "active",
  "actor": {
    "kind": "agent",
    "tool": "claude-code",
    "model": "claude-opus-5-5",
    "reviewed": false
  },
  "links": [
    {
      "kind": "decision",
      "ref": "docs/decisions/0002-hybrid-json-sqlite-store.md"
    }
  ]
}
