{
  "$schema": "../../schemas/note.schema.json",
  "id": "01M5YKKDB87N2DH9HD07X9D0ZF",
  "kind": "gotcha",
  "area": "node",
  "title": "Workspace imports resolve to `dist/` and fail before a build",
  "symptoms": [
    "ERR_MODULE_NOT_FOUND"
  ],
  "cause": "The `poetics-source` export condition was not passed, so Node used the `default` (built) entry.",
  "fix": "Run scripts with `node --conditions=poetics-source` (the `pnpm` scripts already do). Vitest and `tsc` set the condition in their configs.",
  "anchors": {
    "paths": [
      "vitest.config.ts",
      "tsconfig.base.json",
      "package.json"
    ]
  },
  "check": {
    "kind": "test",
    "ref": "scripts/scripts.test.ts",
    "name": "runs directly under Node with type stripping"
  },
  "status": "active",
  "actor": {
    "kind": "agent",
    "tool": "claude-code",
    "model": "claude-opus-5-5",
    "reviewed": false
  },
  "links": [
    {
      "kind": "decision",
      "ref": "docs/decisions/0005-node-24-type-stripping.md"
    }
  ]
}
