{
  "$schema": "../../schemas/note.schema.json",
  "id": "01M5YKKDBCJNDPDPD4PHF1QCRW",
  "kind": "gotcha",
  "area": "schemas",
  "title": "Ajv strict mode rejects `required` inside `if`/`then` and `not`",
  "symptoms": [
    "strict mode: required property \"resolvedBy\" is not defined",
    "strict mode: required property \"interfaceHash\" is not defined at \"https://poetics.dev/schemas/unit.schema.json#/then/not/anyOf/0\" (strictRequired)"
  ],
  "cause": "Ajv's `strictRequired` wants every required property declared in the same schema object, and a `then` branch, or a `not`/`anyOf` inside it, is its own object.",
  "fix": "Declare the property in the branch too: `\"then\": { \"properties\": { \"resolvedBy\": true }, \"required\": [\"resolvedBy\"] }`. To forbid a property in a branch, set it to `false` under `properties` (`\"interfaceHash\": false`) instead of `not: { required }`.",
  "anchors": {
    "paths": [
      "schemas/note.schema.json",
      "schemas/unit.schema.json"
    ],
    "units": [
      {
        "uid": "01M5XDBC8Q3CFWVE0X24JVG5V7",
        "observedAt": "git:c84cac0445ce58d7204860ca32c53380507fee5b"
      }
    ]
  },
  "check": {
    "kind": "test",
    "ref": "packages/store/src/schemas.test.ts"
  },
  "status": "active",
  "actor": {
    "kind": "agent",
    "tool": "claude-code",
    "model": "claude-opus-5-5",
    "reviewed": false
  }
}
